{
  "name": "Клініка Борис",
  "short_name": "Борис",
  "public_name": "Борис",
  "type": "MSP",
  "owner_property_type": "STATE",
  "legal_form": "ПІДПРИЄМЕЦЬ",
  "edrpou": "37367387",
  "kveds": [
    "86.10"
  ],
  "addresses": [
    {
      "type": "REGISTRATION",
      "country": "UA",
      "area": "Житомирська",
      "region": "Бердичівський",
      "settlement": "Київ",
      "settlement_type": "CITY",
      "settlement_id": "dsdafdf",
      "street": "вул. Ніжинська",
      "building": "15-В",
      "apartment": "23",
      "zip": "02090"
    }
  ],
  "phones": [
    {
      "type": "MOBILE",
      "number": "+380503410870"
    }
  ],
  "email": "email@example.com",
  "owner": {
    "first_name": "Петро",
    "last_name": "Іванов",
    "second_name": "Миколайович",
    "position": "лікар",
    "tax_id": "3067305998",
    "birth_date": "1991-08-19",
    "gender": "MALE",
    "email": "email@example.com",
    "documents": [
      {
        "type": "PASSPORT",
        "number": "120518"
      }
    ],
    "phones": [
      {
        "type": "MOBILE",
        "number": "+380503410870"
      }
    ]
  },
  "medical_service_provider": {
    "licenses": [
      {
        "license_number": "fd123443",
        "issued_by": "Кваліфікацйна комісія",
        "issued_date": "1991-08-19",
        "expiry_date": "1991-08-19",
        "active_from_date": "1991-08-19",
        "order_no": "fd123443",
        "what_licensed": "реалізація наркотичних засобів"
      }
    ],
    "accreditation": {
      "category": "ДРУГА",
      "issued_date": "1991-08-19",
      "expiry_date": "1991-08-19",
      "order_no": "fd123443",
      "order_date": "1991-08-19"
    }
  },
  "security": {
    "redirect_uri": "http://example.com/redirect_uri"
  },
  "public_offer": {
    "consent": true,
    "consent_text": "Consent text"
  }
}
